{
 "generated_count": 9,
 "base_url": "",
 "files": [
  {
   "ausmt_id": "au.sample-survey.A1",
   "survey": "CI Sample Survey",
   "station": "A1",
   "format": "edi",
   "url": "edi/sample-survey/Vulcan_A1.edi",
   "size": 30959,
   "sha256": "70e35e356b31bc5f65ae8194bc4ae2d02da5ff8e82c4960be455f463488ee535",
   "tier": "repo",
   "license": "CC-BY-4.0",
   "canon_license": "CC-BY-4.0",
   "custodian": "AusMT CI"
  },
  {
   "ausmt_id": "au.sample-survey.A1",
   "survey": "CI Sample Survey",
   "station": "A1",
   "format": "emtfxml",
   "url": "xml/sample-survey/A1.xml",
   "size": 60510,
   "sha256": "d7d99e710368e0301438aa5f5373e49b005cb616492270596740aad97a191acf",
   "tier": "repo",
   "license": "CC-BY-4.0",
   "canon_license": "CC-BY-4.0",
   "custodian": "AusMT CI"
  },
  {
   "ausmt_id": "au.sample-survey.A1",
   "survey": "CI Sample Survey",
   "station": "A1",
   "format": "mth5",
   "url": "h5/sample-survey/A1.h5",
   "size": 208496,
   "sha256": "b1a38eaecfff128312d2d647478cfc1201f5f9229d074bb6cd8c5111b29faf22",
   "tier": "repo",
   "license": "CC-BY-4.0",
   "canon_license": "CC-BY-4.0",
   "custodian": "AusMT CI"
  },
  {
   "ausmt_id": "au.sample-survey.A2",
   "survey": "CI Sample Survey",
   "station": "A2",
   "format": "edi",
   "url": "edi/sample-survey/Vulcan_A2.edi",
   "size": 30955,
   "sha256": "c5cbc8aa6ff124251c24109a80494cde30830fb1c39794e356b3f832d8997529",
   "tier": "repo",
   "license": "CC-BY-4.0",
   "canon_license": "CC-BY-4.0",
   "custodian": "AusMT CI"
  },
  {
   "ausmt_id": "au.sample-survey.A2",
   "survey": "CI Sample Survey",
   "station": "A2",
   "format": "emtfxml",
   "url": "xml/sample-survey/A2.xml",
   "size": 60449,
   "sha256": "765a59b046e899e22d6291a321cefe4d37170f5a02ef55b07a05b47adc5993c9",
   "tier": "repo",
   "license": "CC-BY-4.0",
   "canon_license": "CC-BY-4.0",
   "custodian": "AusMT CI"
  },
  {
   "ausmt_id": "au.sample-survey.A2",
   "survey": "CI Sample Survey",
   "station": "A2",
   "format": "mth5",
   "url": "h5/sample-survey/A2.h5",
   "size": 208496,
   "sha256": "2e75e2c7ee3ebd69dbcba9f5afa0348722edbae3f50640a7873fb65f5d7fa1bd",
   "tier": "repo",
   "license": "CC-BY-4.0",
   "canon_license": "CC-BY-4.0",
   "custodian": "AusMT CI"
  }
 ],
 "bundles": [
  {
   "survey": "CI Sample Survey",
   "slug": "sample-survey",
   "format": "edi-zip",
   "url": "bundles/sample-survey-edi.zip",
   "size": 20684,
   "sha256": "feab1ee1e13ba72b059b6e66cbc7e456e159fee455bb1e96e5974dea3a1c136a",
   "tier": "repo",
   "license": "CC-BY-4.0",
   "canon_license": "CC-BY-4.0",
   "custodian": "AusMT CI",
   "n_stations": 2
  },
  {
   "survey": "CI Sample Survey",
   "slug": "sample-survey",
   "format": "xml-zip",
   "url": "bundles/sample-survey-xml.zip",
   "size": 16215,
   "sha256": "6d5b92dfd4c944c433f3715d791f831abdd18b11eab44ff7832e4243672a7dce",
   "tier": "repo",
   "license": "CC-BY-4.0",
   "canon_license": "CC-BY-4.0",
   "custodian": "AusMT CI",
   "n_stations": 2
  },
  {
   "survey": "CI Sample Survey",
   "slug": "sample-survey",
   "format": "mth5",
   "url": "bundles/sample-survey-tf.h5",
   "size": 276512,
   "sha256": "dbae45a5c0819729baf0d8252efa155c940101577df8e55d331055d15c0a4368",
   "tier": "repo",
   "license": "CC-BY-4.0",
   "canon_license": "CC-BY-4.0",
   "custodian": "AusMT CI",
   "n_stations": 2
  }
 ]
}
